{
  "schemaVersion":"continuity-g003-active-baseline-v3",
  "reviewProtocol":"continuity-g003-review-protocol-v4",
  "protocolAuthoritySha256":"e1a569f6cd3351c04db5795acc98762d6f2bfd0596826fc4a0c35fe3f870df5e",
  "priorProtocolAuthoritySha256":"f585f5002c5f173a6a083e4a1d547d6b827d2277f140e94d1b8519d02b0124c7",
  "activePack":"cute-redesign-v2",
  "authority":{"publicManifestOutputSha256":"3fee012ba96fbd22ba5921185495bb5d6cbc622bba7b7a2769c56050af2cf430","publicManifestFileSha256":"1b30604091b8da34a3191d903836f8e61126405839abac8b2f1576d380cecd37","successorOutputSha256":"6cee5fa6c9c28d5801eac5df8696c3857787ddf4597035194c749be37aac6168","successorFileSha256":"01b1f63f570f82a304b5e661e14c4454e5b82895dca4e414cfb2b2a511a073f2","assignmentSha256":"9b5d863fa77e6e124b16f64c3268e6badafab801a837d812b07650dd07a2fb0e","effectiveAuthoritySha256":"22cf282dd777c8bf5239b8a6e4d56572143f314b983a189a5b0eb589308d1f92"},
  "signingAuthority":{"algorithm":"Ed25519","authorityEpoch":"g003-authority-epoch-v1","authorityFingerprint":"91336f3180f8cf86cdef4b35f271c1e64eb609cd6b4e7f53360c777fa1a48e54","publicKeySpkiDerBase64":"MCowBQYDK2VwAyEA2hr3xHKrFHs6BKu5uG4l7BjrTqAta3QJDQaHoqcWcgY=","rootKeyCommitmentSha256":"d0dfd57a2b4c273efb9a734ab10cc8ff6c087442e10d8ff50dbb09699f3f43f6","authorityRecordPath":"production/contracts/g003-public-authority-v1.json","authorityRecordSha256":"b8bfa387920542ef4accc420ca7ee0a8217df9edfd6f7ef022c627c5f3232d4b"},
  "schemaBindings":[{"path":"production/contracts/continuity-candidate-review-v4.schema.json","normalizedSha256":"38a56e1137b30785b023560c3c682e7a32e03fa1e90285d7d6b97015bb749433"},{"path":"production/contracts/g003-public-review-artifact-v4.schema.json","normalizedSha256":"1f5f259a4e83351a30c73960e45769276e411b349853daba1ebfc7bd86519cc7"},{"path":"production/contracts/continuity-pack-lock-v3.schema.json","normalizedSha256":"14438ff760324d5909fa9f2aa2680c53edccb06d148e4f18421f60db237fb01e"},{"path":"production/contracts/g003-active-baseline-v3.schema.json","normalizedSha256":"e3708357232aa4e6ce229323b293ef38f9b17897c745007aa396375a2f7dd52b"}],
  "counts":{"regenerate":177,"retain":63,"edges":190,"obligations":367,"dependentQueue":123,"generatedParentEdges":133,"primaryVotes":734,"effectiveRoots":15},
  "targetSource":"signed-canonical-root-redesign-successor-v2",
  "effectiveRootIds":["PG-016","PG-021","PG-022","PG-024","PG-028","PG-029","PG-034","PG-041","PG-046","PG-047","PG-050","PG-052","PG-053","PG-054","PG-056"],
  "protectedFiles":[{"path":"config/creature-assets.json","sha256":"27fbc75e2347a9048ea0d215df56ba8e3fbc62e6d66e9e875b3ed886d8a894bb"},{"path":"production/catalog/creatures.json","sha256":"d9a3265d8e8f07d9ce7f3de52affe3420df4d2aa3406a7f4f364ae1380e9e8a0"},{"path":"macos/Sources/PunchGrowMenuBar/Resources/creatures.json","sha256":"d9a3265d8e8f07d9ce7f3de52affe3420df4d2aa3406a7f4f364ae1380e9e8a0"},{"path":"production/manifests/creature-asset-packs/cute-redesign-v2.json","sha256":"7bb53a3cbdc04ba22ff1c68ca174d92e014d7725c16edcd32fcc175e0ecdf3fa"}],
  "supersedes":"production/reports/biological-continuity-v3/g003-evidence-v2/active-baseline.json"
}
